{
  "schemaVersion": "deus-office-schema/1.0.0",
  "officeId": "OFFICE_MINT_MASTER",
  "canonicalFunction": "MINT_MASTER",
  "department": "FINANCE",
  "titles": {
    "defaultTitle": "Mint Master",
    "culturalTitles": {
      "human": "Moneyer of the Realm",
      "dwarf": "Master Assayer",
      "elf": "Silversmith Warden",
      "halfling": "Coin Stamper",
      "orc": "Slag Master",
      "goblin": "Nugget Puncher",
      "dragonborn": "Keeper of the Crucible",
      "gnome": "Precision Die-Cutter",
      "tiefling": "Mint Warden"
    }
  },
  "jurisdiction": {
    "scope": "SETTLEMENT",
    "factionId": null,
    "settlementId": null,
    "domains": [
      "FOUNDRY_MINT",
      "TREASURY_CHEST"
    ],
    "geographicBounds": null
  },
  "authorityScopes": [
    "COIN_MINT",
    "FINANCIAL_AUDIT"
  ],
  "vacancyState": {
    "status": "VACANT",
    "isVacant": true,
    "sinceYear": 0,
    "sinceTick": 0,
    "vacancyReason": "UNASSIGNED",
    "operationalCapability": 0.0,
    "degradationEffects": [
      "CURRENCY_MINTING_HALTED",
      "BULLION_ASSAYING_UNVERIFIED"
    ]
  },
  "holder": {
    "cardinality": "SINGLE",
    "primaryHolderId": null,
    "actingHolderId": null,
    "coHolderIds": [],
    "deputyIds": [],
    "maxHolders": 1,
    "allowConcurrentOffices": true
  },
  "successionPolicy": {
    "method": "APPOINTMENT",
    "appointmentAuthority": "OFFICE_TREASURER",
    "orderOfPrecedence": [
      "DEPUTY"
    ],
    "eligibilityCriteria": {
      "minAge": 18,
      "requiredCrafts": [
        "BLACKSMITH",
        "SMELTER",
        "JEWELER"
      ],
      "requiredClasses": [],
      "minLevel": null,
      "requireFactionMember": true,
      "additionalCriteria": null
    },
    "interregnumPolicy": "ACTING_DEPUTY",
    "cultureOutcomeOpen": true
  },
  "subordinateOffices": [],
  "parentOfficeId": "OFFICE_TREASURER",
  "workloadProfile": {
    "baselineHoursPerWeek": 10.0,
    "criticalityTier": "CORE_FOUNDER"
  }
}
