{
  "schemaVersion": "deus-office-schema/1.0.0",
  "officeId": "OFFICE_MASTER_OF_WORKS",
  "canonicalFunction": "MASTER_OF_WORKS",
  "department": "INFRASTRUCTURE",
  "titles": {
    "defaultTitle": "Master of Works",
    "culturalTitles": {
      "human": "Chief Architect",
      "dwarf": "Overseer of Masons",
      "elf": "Master Shaper",
      "halfling": "Head Builder",
      "orc": "Quarry Tyrant",
      "goblin": "Digger Boss",
      "dragonborn": "Grand Mason-Warden",
      "gnome": "Chief Structural Engineer",
      "tiefling": "Fortress Architect"
    }
  },
  "jurisdiction": {
    "scope": "SETTLEMENT",
    "factionId": null,
    "settlementId": null,
    "domains": [
      "MINES_AND_WORKS",
      "WORKSHOPS"
    ],
    "geographicBounds": null
  },
  "authorityScopes": [
    "CONSTRUCTION_ORDER",
    "INFRASTRUCTURE_PLAN",
    "LABOR_ALLOCATION"
  ],
  "vacancyState": {
    "status": "VACANT",
    "isVacant": true,
    "sinceYear": 0,
    "sinceTick": 0,
    "vacancyReason": "UNASSIGNED",
    "operationalCapability": 0.0,
    "degradationEffects": [
      "CONSTRUCTION_PROJECTS_STALLED",
      "INFRASTRUCTURE_MAINTENANCE_DEFERRED",
      "SITE_GRADING_UNSURVEYED"
    ]
  },
  "holder": {
    "cardinality": "SINGLE",
    "primaryHolderId": null,
    "actingHolderId": null,
    "coHolderIds": [],
    "deputyIds": [],
    "maxHolders": 1,
    "allowConcurrentOffices": true
  },
  "successionPolicy": {
    "method": "APPOINTMENT",
    "appointmentAuthority": "OFFICE_LEADER",
    "orderOfPrecedence": [
      "DEPUTY"
    ],
    "eligibilityCriteria": {
      "minAge": 18,
      "requiredCrafts": [
        "MASON",
        "CARPENTER",
        "MINER"
      ],
      "requiredClasses": [],
      "minLevel": null,
      "requireFactionMember": true,
      "additionalCriteria": null
    },
    "interregnumPolicy": "ACTING_DEPUTY",
    "cultureOutcomeOpen": true
  },
  "subordinateOffices": [],
  "parentOfficeId": "OFFICE_LEADER",
  "workloadProfile": {
    "baselineHoursPerWeek": 14.0,
    "criticalityTier": "CORE_FOUNDER"
  }
}
