{
  "schemaVersion": "deus-office-schema/1.0.0",
  "officeId": "OFFICE_CLERK",
  "canonicalFunction": "CLERK",
  "department": "RECORDS",
  "titles": {
    "defaultTitle": "Clerk",
    "culturalTitles": {
      "human": "Under-Scribe",
      "dwarf": "Quillwarden",
      "elf": "Scroll Keeper",
      "halfling": "Junior Scrivener",
      "orc": "Scratch Notary",
      "goblin": "Ledger Scraper",
      "dragonborn": "Record Keeper",
      "gnome": "Data Registrar",
      "tiefling": "Clerk"
    }
  },
  "jurisdiction": {
    "scope": "DEPARTMENTAL",
    "factionId": null,
    "settlementId": null,
    "domains": [
      "CIVIL_RECORDS",
      "ARCHIVES"
    ],
    "geographicBounds": null
  },
  "authorityScopes": [
    "CHRONICLE_RECORD",
    "ARCHIVE_MAINTAIN",
    "CENSUS_MAINTAIN"
  ],
  "vacancyState": {
    "status": "VACANT",
    "isVacant": true,
    "sinceYear": 0,
    "sinceTick": 0,
    "vacancyReason": "UNASSIGNED",
    "operationalCapability": 0.0,
    "degradationEffects": [
      "DOCUMENT_FILING_BACKLOG",
      "RECORD_RETRIEVAL_LATENCY"
    ]
  },
  "holder": {
    "cardinality": "SINGLE",
    "primaryHolderId": null,
    "actingHolderId": null,
    "coHolderIds": [],
    "deputyIds": [],
    "maxHolders": 1,
    "allowConcurrentOffices": true
  },
  "successionPolicy": {
    "method": "APPOINTMENT",
    "appointmentAuthority": "OFFICE_RECORDER",
    "orderOfPrecedence": [
      "DEPUTY"
    ],
    "eligibilityCriteria": {
      "minAge": 18,
      "requiredCrafts": [
        "SCRIBE"
      ],
      "requiredClasses": [],
      "minLevel": null,
      "requireFactionMember": true,
      "additionalCriteria": null
    },
    "interregnumPolicy": "ACTING_DEPUTY",
    "cultureOutcomeOpen": true
  },
  "subordinateOffices": [],
  "parentOfficeId": "OFFICE_RECORDER",
  "workloadProfile": {
    "baselineHoursPerWeek": 25.0,
    "criticalityTier": "SUBORDINATE_EXPANSION"
  }
}
