{
  "schemaVersion": "deus-office-schema/1.0.0",
  "officeId": "OFFICE_TREASURER",
  "canonicalFunction": "TREASURER",
  "department": "FINANCE",
  "titles": {
    "defaultTitle": "Treasurer",
    "culturalTitles": {
      "human": "Royal Treasurer",
      "dwarf": "Keeper of the Vault",
      "elf": "Purser of the Grove",
      "halfling": "Bursar",
      "orc": "Hoard Master",
      "goblin": "Coin Snatcher",
      "dragonborn": "Grand Assayer",
      "gnome": "Chief Accountant",
      "tiefling": "Exchequer"
    }
  },
  "jurisdiction": {
    "scope": "FACTION",
    "factionId": null,
    "settlementId": null,
    "domains": [
      "TREASURY_CHEST",
      "TAX_DISTRICTS",
      "PAYROLL_OFFICE"
    ],
    "geographicBounds": null
  },
  "authorityScopes": [
    "BUDGET_DISBURSE",
    "TAX_ASSESS",
    "WAGE_PAY",
    "FINANCIAL_AUDIT"
  ],
  "vacancyState": {
    "status": "VACANT",
    "isVacant": true,
    "sinceYear": 0,
    "sinceTick": 0,
    "vacancyReason": "UNASSIGNED",
    "operationalCapability": 0.0,
    "degradationEffects": [
      "WAGE_PAYROLL_FROZEN",
      "TAX_AUDIT_HALTED",
      "PUBLIC_BUDGET_LOCKED"
    ]
  },
  "holder": {
    "cardinality": "SINGLE",
    "primaryHolderId": null,
    "actingHolderId": null,
    "coHolderIds": [],
    "deputyIds": [],
    "maxHolders": 1,
    "allowConcurrentOffices": true
  },
  "successionPolicy": {
    "method": "APPOINTMENT",
    "appointmentAuthority": "OFFICE_LEADER",
    "orderOfPrecedence": [
      "DEPUTY",
      "OFFICE_PAYMASTER",
      "OFFICE_MINT_MASTER"
    ],
    "eligibilityCriteria": {
      "minAge": 18,
      "requiredCrafts": [],
      "requiredClasses": [],
      "minLevel": null,
      "requireFactionMember": true,
      "additionalCriteria": null
    },
    "interregnumPolicy": "ACTING_DEPUTY",
    "cultureOutcomeOpen": true
  },
  "subordinateOffices": [
    "OFFICE_MINT_MASTER",
    "OFFICE_TAX_COLLECTOR",
    "OFFICE_PAYMASTER"
  ],
  "parentOfficeId": "OFFICE_LEADER",
  "workloadProfile": {
    "baselineHoursPerWeek": 14.0,
    "criticalityTier": "CORE_FOUNDER"
  }
}
